1221,Inventory,NV01,04,BBIE,1,0..1,Inventory Location,Location Description,Text,,,TEXT 1000,LctDscr,"Textual description of the location identified by Location_Code: for example, location name.",,
1222,Inventory,NV01,05,BBIE,1,0..1,Inventory Location,Location Type,Text,,,TEXT 12,LctTyp,Textual description of the location identified by Location_Code [LctCd].EXAMPLE   Location name.,,
1223,Inventory,NV01,06,RFBIE,1,0..1,Inventory Location,Inventory Organization Code,,,Business Segment,IDENTIFIER 25,InvOrgCd,The code of the inventory organization. Shall match the Business_Segment_Code [BusSgCd] in the BAS_Business_Segment [BasBusSg] table.,BAS BUSINESS SEGMENT,Business Segment Code
1224,Inventory,NV01,07,BBIE,1,0..1,Inventory Location,Location Active Flag,Indicator,,,BOOLEAN,LctActiveFlag,"This indicates whether this location is active or inactive: for example, 1 is active and 0 is inactive.",,
1225,Inventory,NV01,NV51,ASBIE,1,0..1,Inventory Location,Specified,,Physical Address,,,PhysAdr,Physical address information.,,
1226,Inventory,NV51,01,BBIE,2,0..1,Physical Address,Street Address1,Text,,,TEXT 100,StreetAdr1,Line 1 of the street address.,,
1227,Inventory,NV51,02,BBIE,2,0..1,Physical Address,Street Address2,Text,,,TEXT 100,StreetAdr2,Line 2 of the street address.,,
1228,Inventory,NV51,03,BBIE,2,0..1,Physical Address,City Name,Text,,,CITY NAME,CityNm,City name of this address.,,
1229,Inventory,NV51,04,BBIE,2,0..1,Physical Address,State Province Code,Code,,,STATE PROVINCE CODE,StatePrvncCd,The state or province of this address (in accordance with ISO 3166-2).,,
1230,Inventory,NV51,05,BBIE,2,0..1,Physical Address,Postal Code,Code,,,POSTAL CODE,PostalCd,Zip or postal code of this address.,,
1231,Inventory,NV51,06,BBIE,2,0..1,Physical Address,Country Code,Code,,,COUNTRY CODE,CntryCd,The country code of this address (in accordance with ISO 3166-1).,,
1232,Inventory,NV01,NV52,ASBIE,1,0..n,Inventory Location,Specified,,Business Segment,,,BusSg,Contains associated Business Segment information.,,
1233,Inventory,NV52,01,BBIE,2,0..1,Business Segment,Sequence Number,Code,,,TEXT 60,SqNr,Number or text to keep the Business Segments in a predefined order.,,
1234,Inventory,NV52,02,RFBIE,2,0..1,Business Segment,Business Segment Code,,,Business Segment,IDENTIFIER 25,BusSgCd,Contains a code to identify the associated business segment. Must match the Business_Segment_Code [BusSgCd] in BAS_Business_Segment [BasBusSg].,BAS BUSINESS SEGMENT,Business Segment Code
1235,Inventory,NV02,03,ABIE,0,--,Inventory Product Type,,,,,,InvPrdctTyp,Contains inventory product type information and the tree structure information of inventory product type.,,
1236,Inventory,NV02,04,BBIE,1,1..1,Inventory Product Type,Inventory Product Type ID,Identifier,,,IDENTIFIER 60,InvPrdctTypId,Unique identifier for the inventory product type used to express inventory or product type with hierarchy.Typically auto-generated by the system.,,
1237,Inventory,NV02,05,BBIE,1,0..1,Inventory Product Type,Inventory Product Type Code,Code,,,INVENTORY PRODUCT TYPE CODE,InvPrdctTypCd,"Code for the inventory product type.EXAMPLE   01 is raw materials, 02 is work in-progress, 03 is finished goods, 04 is supplies.",,
1238,Inventory,NV02,06,BBIE,1,0..1,Inventory Product Type,Inventory Product Type Name,Text,,,TEXT 100,InvPrdctTypNm,"Name of the inventory product type.EXAMPLE   Raw materials, work in-progress, finished goods, supplies.",,
1239,Inventory,NV02,07,BBIE,1,0..1,Inventory Product Type,INV Product Type Description,Text,,,TEXT 1000,InvPrdctTypDscr,Description of the inventory product type.,,
1240,Inventory,NV02,08,RFBIE,1,0..1,Inventory Product Type,Parent INV Product Type ID,,,Inventory Product Type,IDENTIFIER 60,ParInvPrdctTypId,Unique identifier for the parent inventory product type.Typically auto-generated by the system.Shall match the Inventory_Product_Type_ID [InvPrdctTypId] of the record of parent inventory type in the INV_Product_Type [InvPrdctTyp] table.,INV PRODUCT TYPE,Inventory Product Type ID
1241,Inventory,NV02,NV53,ASBIE,1,0..n,Inventory Product Type,Specified,,Business Segment,,,BusSg,Contains associated Business Segment information.,,
1242,Inventory,NV53,01,BBIE,2,0..1,Business Segment,Sequence Number,Code,,,TEXT 60,SqNr,Number or text to keep the Business Segments in a predefined order.,,
1243,Inventory,NV53,02,RFBIE,2,0..1,Business Segment,Business Segment Code,,,Business Segment,IDENTIFIER 25,BusSgCd,Contains a code to identify the associated business segment. Must match the Business_Segment_Code [BusSgCd] in BAS_Business_Segment [BasBusSg].,BAS BUSINESS SEGMENT,Business Segment Code
1244,Inventory,NV03,,ABIE,0,--,Inventory Product,,,,,,InvPrdct,"Contains basic attributes of an inventory item and other tracked item through the purchase, use and sales.",,
1245,Inventory,NV03,01,BBIE,1,1..1,Inventory Product,Inventory Product ID,Identifier,,,IDENTIFIER 75,InvPrdctId,Unique identifier for the inventory item.Typically auto-generated by the system.,,
1246,Inventory,NV03,02,BBIE,1,0..1,Inventory Product,Inventory Product Code,Text,,,TEXT 80,InvPrdctCd,Internal code of the inventory product at the local level for tracking this product.,,
1247,Inventory,NV03,03,RFBIE,1,0..1,Inventory Product,Inventory Product Type ID,,,Inventory Product Type,IDENTIFIER 60,InvPrdctTypId,Unique identifier for the inventory product type used to express inventory or product type with hierarchy.Typically auto-generated by the system.Shall match the Inventory_Product_Type_ID [InvPrdctTypId] in the INV_Product_Type [InvPrdctTyp] table.,INV PRODUCT TYPE,Inventory Product Type ID
1248,Inventory,NV03,04,BBIE,1,0..1,Inventory Product,Product Group1,Text,,,TEXT 25,PrdctGroup1,"Product descriptor #1.EXAMPLE   Tires, accessories.",,
1249,Inventory,NV03,05,BBIE,1,0..1,Inventory Product,Product Group2,Text,,,TEXT 25,PrdctGroup2,Product descriptor #2.EXAMPLE   Brand.,,
1250,Inventory,NV03,06,BBIE,1,0..1,Inventory Product,Inventory Bar Code,Text,,,TEXT 60,InvBarCd,Universal Product Code or other external identifier.EXAMPLE   The product code from a primary supplier.,,
1251,Inventory,NV03,07,RFBIE,1,0..1,Inventory Product,Preferred Supplier ID,,,Supplier,IDENTIFIER 100,PreferredSuplId,"Unique identifier for the supplier that the organization has designated as the first choice from whom to procure this item.The selection may be for contractual or practical reasons, which may include historical reliability and quality, advantageous terms (e.g. delivery, pricing), a specific customer request or other reasons.Typically auto-generated by the system.Shall match the Supplier_Account_ID [SuplAcntId] from the BAS_Supplier [BasSupl] table.",BAS SUPPLIER,Supplier Account ID
1252,Inventory,NV03,08,RFBIE,1,0..1,Inventory Product,Basic UOM Code,,,Measurement Unit,MEASUREMENT UNIT CODE,BasicUomCd,"Code for the basic measurement unit for the inventory, which cannot be further separated.EXAMPLE   The basic measurement unit for a pencil is pieces, however, the business can also use boxes as a measurement unit for stocking or for managerial purposes.Shall match the UOM_Code [UomCd] in the BAS_Measurement_Unit [BasMeaUnit] table.",BAS MEASUREMENT UNIT,UOM Code
1253,Inventory,NV03,09,BBIE,1,0..1,Inventory Product,Default Costing Method,Text,,,TEXT 60,DftCstngMthd,"Description of the costing method.EXAMPLE   LIFO, FIFO, average, standard, specific identification.",,
1254,Inventory,NV03,10,RFBIE,1,0..1,Inventory Product,Default Stocking UOM Code,,,Measurement Unit,MEASUREMENT UNIT CODE,DftStckUomCd,"Code for the measurement unit that is normally used for stock.EXAMPLE   To measure pencils for stocking purpose, boxes as measurement unit is usually used, which is different from the basic measurement unit pieces.Shall match the UOM_Code [UomCd] in the BAS_Measurement_Unit [BasMeaUnit] table.",BAS MEASUREMENT UNIT,UOM Code
1255,Inventory,NV03,11,RFBIE,1,0..1,Inventory Product,GL Asset Account Number,,,Chart Of Accounts,GL ACCOUNT NUMBER 100,GlAssetAcntNr,Number of the GL account on which the balance sheet amount of inventory product is recognized.EXAMPLE   Identifier for the raw inventory account.Shall match the GL_Account_Number [GlAcntNr] in the BAS_Chart_Of_Accounts [BasChartOfAcnts] table.,BAS CHART OF ACCOUNTS,GL Account Number
1256,Inventory,NV03,12,RFBIE,1,0..1,Inventory Product,GL Cost Account Number,,,Chart Of Accounts,GL ACCOUNT NUMBER 100,GlCostAcntNr,Number of the GL account on which the income statement amount of inventory product is recognized.EXAMPLE   Identifier for the cost of sales account.Shall match the GL_Account_Number [GlAcntNr] in the BAS_Chart_Of_Accounts [BasChartOfAcnts] table.,BAS CHART OF ACCOUNTS,GL Account Number
1257,Inventory,NV03,13,BBIE,1,0..1,Inventory Product,Out Of Service Date,Date,,,DATE,OutOfSrvcDt,Date when the inventory is out of service.EXAMPLE   The date when the inventory is discontinued due to changes in design and replacement of materials.,,
1258,Inventory,NV03,14,BBIE,1,0..1,Inventory Product,Out Of Service Flag,Indicator,,,BOOLEAN,OutOfSrvcFlag,"Sign of out-of-service status.EXAMPLE   0 is no, 1 is yes.",,
1259,Inventory,NV03,15,BBIE,1,0..1,Inventory Product,Lot Number,Code,,,TEXT 60,LotNr,Number associated with a product that is used for tracking and managing the lot.,,
1260,Inventory,NV03,16,BBIE,1,0..1,Inventory Product,Serial Number,Code,,,TEXT 60,SerialNr,"Number associated with an individual product item that is used for tracking and managing.EXAMPLE   A company purchases 10 computers, with each computer assigned an individual serial number.",,
1261,Inventory,NV03,NV54,ASBIE,1,0..n,Inventory Product,Specified,,Business Segment,,,BusSg,Contains associated Business Segment information.,,
1262,Inventory,NV54,01,BBIE,2,0..1,Business Segment,Sequence Number,Code,,,TEXT 60,SqNr,Number or text to keep the Business Segments in a predefined order.,,
1263,Inventory,NV54,02,RFBIE,2,0..1,Business Segment,Business Segment Code,,,Business Segment,IDENTIFIER 25,BusSgCd,Contains a code to identify the associated business segment. Must match the Business_Segment_Code [BusSgCd] in BAS_Business_Segment [BasBusSg].,BAS BUSINESS SEGMENT,Business Segment Code
1264,Inventory,NV04,03,ABIE,0,--,Inventory On Hand,,,,,,InvOnHand,"Contains information of inventory on hand (e.g. suppliers, quantities of items by location and amounts as of the specified date).",,
1265,Inventory,NV04,04,BBIE,1,1..1,Inventory On Hand,Inventory ID,Identifier,,,IDENTIFIER 75,InvId,"Unique identifier for the inventory.Typically auto-generated by the system. The unique value means that each line in the data table under consideration has a unique, non-repetitive, serial number for identification.",,
1266,Inventory,NV04,05,RFBIE,1,0..1,Inventory On Hand,Inventory Product ID,,,Inventory Product,IDENTIFIER 75,InvPrdctId,Unique identifier for the inventory item.Typically auto-generated by the system.Shall match the Inventory_Product_ID [InvPrdctId] in the INV_Product [InvPrdct] table.,INV PRODUCT,Inventory Product ID
1267,Inventory,NV04,06,BBIE,1,0..1,Inventory On Hand,Lot Number,Code,,,TEXT 60,LotNr,Number associated with a product that is used for tracking and managing the lot.,,
1268,Inventory,NV04,07,BBIE,1,0..1,Inventory On Hand,Serial Number,Code,,,TEXT 60,SerialNr,"Number associated with an individual product item that is used for tracking and managing.EXAMPLE   A company purchases 10 computers, with each computer assigned an individual serial number.",,
1269,Inventory,NV04,08,BBIE,1,0..1,Inventory On Hand,Inventory ABC Code,Code,,,INVENTORY ABC CODE,InvAbcCd,"Code for the importance, monetary value or other measure of the item according to Markov's rule for selective inventory control, where 20 % of items are responsible for 80 % of the value or risk.A = top 20 % representing 80 % of risk:B = 30 %, representing 15 % of risk:C = 50 % of items representing only 5 % of risk.",,
1270,Inventory,NV04,09,RFBIE,1,0..1,Inventory On Hand,Location ID,,,Inventory Location,IDENTIFIER 75,LctId,Unique identifier for the organization.Shall be a valid entry in the INV_Location [InvLct] table.Typically auto-generated by the system.Shall match the Location_ID [LctId] in the INV_Location [InvLct] table.,INV LOCATION,Location ID
1271,Inventory,NV04,10,BBIE,1,0..1,Inventory On Hand,Inventory As Of Date,Date,,,DATE,InvAsOfDt,Specified date to which inventory information applies.,,
1272,Inventory,NV04,11,BBIE,1,0..1,Inventory On Hand,INV PUR YearToDate Quantity,Quantity,,,QUANTITY,InvPurYrtodtQt,Quantity purchased to this location year to date in the Basic_UOM_Code [BasicUomCd].,,
1273,Inventory,NV04,12,BBIE,1,0..1,Inventory On Hand,INV Sold YearToDate Quantity,Quantity,,,QUANTITY,InvSoldYrtodtQt,Quantity sold from this location year to date in the Basic_UOM_Code [BasicUomCd].,,
1274,Inventory,NV04,13,RFBIE,1,0..1,Inventory On Hand,Inventory Organization Code,,,Business Segment,IDENTIFIER 25,InvOrgCd,"Code for the inventory organization, which refers to the organizational unit, physical or virtual, where the inventory transaction and balances may be tracked and monitored.It provides inventory information to modules such as purchase and sales. The simplest form of inventory organization is warehouse.Shall match the Business_Segment_Code [BusSgCd] in the BAS_Business_Segment [BasBusSg] table.",BAS BUSINESS SEGMENT,Business Segment Code
1275,Inventory,NV04,14,RFBIE,1,0..1,Inventory On Hand,Cost Organization Code,,,Business Segment,IDENTIFIER 25,CostOrgCd,"Code for the cost organization, which refers to the organizational unit/level where the cost of outbound inventory will be calculated.The calculation may be done at the corporate level, the stocking organization level or at the particular locations where inventory is stored.Shall match the Business_Segment_Code [BusSgCd] in the BAS_Business_Segment [BasBusSg] table.",BAS BUSINESS SEGMENT,Business Segment Code
1276,Inventory,NV04,15,RFBIE,1,0..1,Inventory On Hand,Inventory Costing UOM Code,,,Measurement Unit,MEASUREMENT UNIT CODE,InvCstngUomCd,Code for the measurement unit for the inventory's cost.Shall match the UOM_Code [UomCd] in the BAS_Measurement_Unit [BasMeaUnit] table.,BAS MEASUREMENT UNIT,UOM Code
1277,Inventory,NV04,16,RFBIE,1,0..1,Inventory On Hand,Inventory Purchasing UOM Code,,,Measurement Unit,MEASUREMENT UNIT CODE,InvPrchsngUomCd,Code for the primary measurement unit of how goods enter the organization through purchase.Shall match the UOM_Code [UomCd] in the BAS_Measurement_Unit [BasMeaUnit] table.,BAS MEASUREMENT UNIT,UOM Code
1278,Inventory,NV04,17,RFBIE,1,0..1,Inventory On Hand,Inventory Selling UOM Code,,,Measurement Unit,MEASUREMENT UNIT CODE,InvSellingUomCd,Code for the primary measurement unit of how goods leave the organization through sales.Shall match the UOM_Code [UomCd] in the BAS_Measurement_Unit [BasMeaUnit] table.,BAS MEASUREMENT UNIT,UOM Code
1279,Inventory,NV04,18,RFBIE,1,0..1,Inventory On Hand,Inventory Stocking UOM Code,,,Measurement Unit,MEASUREMENT UNIT CODE,InvStckUomCd,Code for the measurement unit used associated with the quantity used for stocking inventory.Shall match the UOM_Code [UomCd] in the BAS_Measurement_Unit [BasMeaUnit] table.,BAS MEASUREMENT UNIT,UOM Code
1280,Inventory,NV04,19,BBIE,1,0..1,Inventory On Hand,Quantity,Quantity,,,QUANTITY,Qt,Book quantity as expressed in the Inventory_Stocking_UOM_Code [InvStckUomCd].,,
1281,Inventory,NV04,20,BBIE,1,0..1,Inventory On Hand,System Quantity,Quantity,,,QUANTITY,SystQt,Actual quantity on hand from the physical count in the Basic_UOM_Code [BasicUomCd].,,
1282,Inventory,NV04,21,BBIE,1,0..1,Inventory On Hand,Physical Count Quantity,Quantity,,,QUANTITY,PhysCountQt,Quantity on hand at the last physical count when multiple counts are performed in the Basic_UOM_Code [BasicUomCd].,,
1283,Inventory,NV04,22,BBIE,1,0..1,Inventory On Hand,Last Count Date,Date,,,DATE,LstCountDt,Date of the last physical count.,,
1284,Inventory,NV04,23,BBIE,1,0..1,Inventory On Hand,Inventory List Price,Monatary Amount,,,AMOUNT,InvListPrice,List or suggested retail price.,,
1285,Inventory,NV04,24,BBIE,1,0..1,Inventory On Hand,Inventory Cost,Monatary Amount,,,AMOUNT,InvCost,Cost per unit using the method found in the Inventory_Cost_Method [InvCostMthd].,,
1286,Inventory,NV04,25,BBIE,1,0..1,Inventory On Hand,Inventory Cost Method,Text,,,TEXT 25,InvCostMthd,"Description of the costing method.EXAMPLE   LIFO, FIFO, average, standard, specific identification.",,
1287,Inventory,NV04,26,BBIE,1,0..1,Inventory On Hand,Average Cost,Monatary Amount,,,AMOUNT,AverageCost,Average cost of per unit.,,
1288,Inventory,NV04,27,BBIE,1,0..1,Inventory On Hand,Standard Cost,Monatary Amount,,,AMOUNT,StdCost,Standard cost per unit.,,
1289,Inventory,NV04,28,BBIE,1,0..1,Inventory On Hand,Specific Cost,Monatary Amount,,,AMOUNT,SpecificCost,Specific cost per unit.,,
1290,Inventory,NV04,29,RFBIE,1,0..1,Inventory On Hand,Functional Currency Code,,,Currency,CURRENCY CODE,FuncCurCd,Functional or group currency related to the balance (in accordance with ISO 4217).Shall match the Currency_Code [CurCd] in the BAS_Currency [BasCur] table.,BAS CURRENCY,Currency Code
1291,Inventory,NV04,30,BBIE,1,0..1,Inventory On Hand,Bin ID,Text,,,TEXT 25,BinId,Optional identifier for the sub-location. The code used in the system.,,
1292,Inventory,NV04,31,BBIE,1,0..1,Inventory On Hand,Bin Location,Text,,,TEXT 50,BinLct,Description of the bin location used in the system.,,
1293,Inventory,NV04,NV55,ASBIE,1,0..n,Inventory On Hand,Specified,,Business Segment,,,BusSg,Contains associated Business Segment information.,,
1294,Inventory,NV55,01,BBIE,2,0..1,Business Segment,Sequence Number,Code,,,TEXT 60,SqNr,Number or text to keep the Business Segments in a predefined order.,,
1295,Inventory,NV55,02,RFBIE,2,0..1,Business Segment,Business Segment Code,,,Business Segment,IDENTIFIER 25,BusSgCd,Contains a code to identify the associated business segment. Must match the Business_Segment_Code [BusSgCd] in BAS_Business_Segment [BasBusSg].,BAS BUSINESS SEGMENT,Business Segment Code
1296,Inventory,NV05,,ABIE,0,--,Inventory Transaction,,,,,,InvTr,Contains transaction history impacting the inventory accounts during the specified time period.,,
1297,Inventory,NV05,01,BBIE,1,1..1,Inventory Transaction,Transaction Document ID,Identifier,,,IDENTIFIER 100,TrDocId,"Unique identifier for the picking ticket, shipping notice or other document created upon or associated with movement.Typically auto-generated by the system.",,
1298,Inventory,NV05,02,BBIE,1,1..1,Inventory Transaction,Transaction Document Line ID,Identifier,,,IDENTIFIER 100,TrDocLnId,Unique identifier for the line number for a document other than a customer order or supplier purchase order.Typically auto-generated by the system.,,
1299,Inventory,NV05,03,RFBIE,1,0..1,Inventory Transaction,Project ID,,,Project,IDENTIFIER 60,ProjId,Unique identifier for the project.Typically auto-generated by the system.Shall match the Project_ID [ProjId] in the BAS_Project [BasProj] table.,BAS PROJECT,Project ID
1300,Inventory,NV05,04,BBIE,1,0..1,Inventory Transaction,Transaction Order ID,Text,,,TEXT 100,TrOrdId,"Unique identifier for the customer order, (supplier) purchase order or other document associated with the transaction.Typically auto-generated by the system.",,
1301,Inventory,NV05,05,BBIE,1,0..1,Inventory Transaction,Transaction Order Line ID,Text,,,TEXT 100,TrOrdLnId,"Unique identifier for the line item from a customer order or (supplier) purchase order, in order to differentiate between multiple items in a single order for different quantities.Typically auto-generated by the system.",,
1302,Inventory,NV05,06,BBIE,1,0..1,Inventory Transaction,Transaction Date,Date,,,DATE,TrDt,"Date of activity per associated transaction document, if applicable.",,
1303,Inventory,NV05,07,BBIE,1,0..1,Inventory Transaction,Transaction Time,Time,,,TIME,TrTm,"Time of the activity as per the associated transaction document, if applicable.",,
1304,Inventory,NV05,08,BBIE,1,0..1,Inventory Transaction,Transaction Type,Text,,,TEXT 80,TrTyp,"Captures information regarding movements and adjustments.Movement types may include receipt, shipment, transfer, return, moved to production and moved from production. Quantity adjustment types may include physical count adjustment, damage, obsolete and scrapped. Cost adjustments may include the lowering of cost or market realization.",,
1305,Inventory,NV05,09,BBIE,1,0..1,Inventory Transaction,Transaction Type System,Text,,,TEXT 60,TrTypSyst,Transaction code local to the underlying accounting software system.,,
1306,Inventory,NV05,10,BBIE,1,0..1,Inventory Transaction,Transaction Description,Text,,,TEXT 1000,TrDscr,Description of the transaction.,,
1307,Inventory,NV05,11,BBIE,1,0..1,Inventory Transaction,Transaction Quantity,Quantity,,,QUANTITY,TrQt,"Quantity affected as expressed in the location stocking organization in the Basic_UOM_Code [BasicUomCd]. When the inventory is received, the number involved will be a positive number. When the inventory is dispatched, the number involved will be a negative number.",,
1308,Inventory,NV05,12,RFBIE,1,0..1,Inventory Transaction,Supplier Account ID,,,Supplier,IDENTIFIER 100,SuplAcntId,Unique identifier for the supplier.Typically auto-generated by the system.Shall match the Supplier_Account_ID [SuplAcntId] in the BAS_Supplier [BasSupl] table.,BAS SUPPLIER,Supplier Account ID
1309,Inventory,NV05,13,RFBIE,1,0..1,Inventory Transaction,Customer Account ID,,,Customer,IDENTIFIER 100,CustAcntId,Unique identifier for the receiving customer.Typically auto-generated by the system.Shall match the Customer_Account_ID [CustAcntId] in the BAS_Customer [BasCust] table.,BAS CUSTOMER,Customer Account ID
1310,Inventory,NV05,14,BBIE,1,0..1,Inventory Transaction,Inventory Document ID,Text,,,TEXT 60,InvDocId,"Unique identifier for the inventory document, specifying the sources where the inventory originates.Typically auto-generated by the system.",,
1311,Inventory,NV05,15,BBIE,1,0..1,Inventory Transaction,Inventory Document Number,Code,,,TEXT 80,InvDocNr,Number of the inventory document.This number is usually generated by manual input or is system-generated.EXAMPLE   201305020001.,,
1312,Inventory,NV05,16,BBIE,1,0..1,Inventory Transaction,Inventory Document Line ID,Text,,,TEXT 60,InvDocLnId,Unique identifier for the inventory document line.Typically auto-generated by the system.,,
1313,Inventory,NV05,17,BBIE,1,0..1,Inventory Transaction,Inventory Document Line Number,Code,,,TEXT 10,InvDocLnNr,Number of the inventory document line.This number is generated either by manual input or by the system.,,
1314,Inventory,NV05,18,BBIE,1,0..1,Inventory Transaction,Status,Code,,,STATUS CODE,Stat,"Status of the inventory document.EXAMPLE   New, save, submit, void, frozen.",,
1315,Inventory,NV05,19,RFBIE,1,0..1,Inventory Transaction,Inventory Organization Code,,,Business Segment,IDENTIFIER 25,InvOrgCd,"Code for the inventory organization, which refers to the organizational unit, physical or virtual, where the inventory transaction and balances may be tracked and monitored.It provides inventory information to modules such as purchase and sales. The simplest form of inventory organization is warehouse.Shall match the Business_Segment_Code [BusSgCd] in the BAS_Business_Segment [BasBusSg] table.",BAS BUSINESS SEGMENT,Business Segment Code
1316,Inventory,NV05,20,RFBIE,1,0..1,Inventory Transaction,Inventory Stocking UOM Code,,,Measurement Unit,MEASUREMENT UNIT CODE,InvStckUomCd,Code for the measurement unit used associated with the quantity used for stocking inventory.Shall match the UOM_Code [UomCd] in the BAS_Measurement_Unit [BasMeaUnit] table.,BAS MEASUREMENT UNIT,UOM Code
1317,Inventory,NV05,21,RFBIE,1,0..1,Inventory Transaction,Inventory Costing UOM Code,,,Measurement Unit,MEASUREMENT UNIT CODE,InvCstngUomCd,Code for the measurement unit for the inventory's cost.Shall match the UOM_Code [UomCd] in the BAS_Measurement_Unit [BasMeaUnit] table.,BAS MEASUREMENT UNIT,UOM Code
1318,Inventory,NV05,22,RFBIE,1,0..1,Inventory Transaction,Inventory Product ID,,,Inventory Product,IDENTIFIER 75,InvPrdctId,Unique identifier for the inventory item.Typically auto-generated by the system.Shall match the Inventory_Product_ID [InvPrdctId] in the INV_Product [InvPrdct] table.,INV PRODUCT,Inventory Product ID
1319,Inventory,NV05,23,BBIE,1,0..1,Inventory Transaction,Lot Number,Code,,,TEXT 60,LotNr,Number associated with a product that is used for tracking and managing the lot.,,
1320,Inventory,NV05,24,BBIE,1,0..1,Inventory Transaction,Serial Number,Code,,,TEXT 60,SerialNr,"Number associated with an individual product item that is used for tracking and managing.EXAMPLE   A company purchases 10 computers, with each computer assigned an individual serial number.",,
1321,Inventory,NV05,25,BBIE,1,0..1,Inventory Transaction,Inventory Required By,Text,,,TEXT 80,InvRequiredBy,Person or organization that makes the requisition for an inventory.,,
1322,Inventory,NV05,26,RFBIE,1,0..1,Inventory Transaction,Inventory From Location ID,,,Inventory Location,IDENTIFIER 75,InvFromLctId,Unique identifier for the stock trading source location.Typically auto-generated by the system.Shall match the Location_ID [LctId] in the INV_Location [InvLct] table.,INV LOCATION,Location ID
1323,Inventory,NV05,27,RFBIE,1,0..1,Inventory Transaction,Inventory To Location ID,,,Inventory Location,IDENTIFIER 75,InvToLctId,Unique identifier for the stock trading destination.Typically auto-generated by the system.Shall match the Location_ID [LctId] in the INV_Location [InvLct] table.,INV LOCATION,Location ID
